"id","name","code","slug","state_id:id","country_id","type"
"res_district_570","Huyện Cam Lâm","VN-56-570","Huyện Cam Lâm, Tỉnh Khánh Hòa","base.state_vn_VN-34","VN",1
"res_district_571","Huyện Vạn Ninh","VN-56-571","Huyện Vạn Ninh, Tỉnh Khánh Hòa","base.state_vn_VN-34","VN",1
"res_district_572","Thị xã Ninh Hòa","VN-56-572","Thị xã Ninh Hòa, Tỉnh Khánh Hòa","base.state_vn_VN-34","VN",2
"res_district_573","Huyện Khánh Vĩnh","VN-56-573","Huyện Khánh Vĩnh, Tỉnh Khánh Hòa","base.state_vn_VN-34","VN",1
"res_district_574","Huyện Diên Khánh","VN-56-574","Huyện Diên Khánh, Tỉnh Khánh Hòa","base.state_vn_VN-34","VN",1
"res_district_575","Huyện Khánh Sơn","VN-56-575","Huyện Khánh Sơn, Tỉnh Khánh Hòa","base.state_vn_VN-34","VN",1
"res_district_576","Huyện Trường Sa","VN-56-576","Huyện Trường Sa, Tỉnh Khánh Hòa","base.state_vn_VN-34","VN",1
"res_district_582","Thành phố Phan Rang-Tháp Chàm","VN-58-582","Thành phố Phan Rang-Tháp Chàm, Tỉnh Ninh Thuận","base.state_vn_VN-36","VN",3
"res_district_584","Huyện Bác Ái","VN-58-584","Huyện Bác Ái, Tỉnh Ninh Thuận","base.state_vn_VN-36","VN",1
"res_district_585","Huyện Ninh Sơn","VN-58-585","Huyện Ninh Sơn, Tỉnh Ninh Thuận","base.state_vn_VN-36","VN",1
"res_district_586","Huyện Ninh Hải","VN-58-586","Huyện Ninh Hải, Tỉnh Ninh Thuận","base.state_vn_VN-36","VN",1
"res_district_587","Huyện Ninh Phước","VN-58-587","Huyện Ninh Phước, Tỉnh Ninh Thuận","base.state_vn_VN-36","VN",1
"res_district_588","Huyện Thuận Bắc","VN-58-588","Huyện Thuận Bắc, Tỉnh Ninh Thuận","base.state_vn_VN-36","VN",1
"res_district_589","Huyện Thuận Nam","VN-58-589","Huyện Thuận Nam, Tỉnh Ninh Thuận","base.state_vn_VN-36","VN",1
"res_district_593","Thành phố Phan Thiết","VN-60-593","Thành phố Phan Thiết, Tỉnh Bình Thuận","base.state_vn_VN-40","VN",3
"res_district_594","Thị xã La Gi","VN-60-594","Thị xã La Gi, Tỉnh Bình Thuận","base.state_vn_VN-40","VN",2
"res_district_595","Huyện Tuy Phong","VN-60-595","Huyện Tuy Phong, Tỉnh Bình Thuận","base.state_vn_VN-40","VN",1
"res_district_596","Huyện Bắc Bình","VN-60-596","Huyện Bắc Bình, Tỉnh Bình Thuận","base.state_vn_VN-40","VN",1
"res_district_597","Huyện Hàm Thuận Bắc","VN-60-597","Huyện Hàm Thuận Bắc, Tỉnh Bình Thuận","base.state_vn_VN-40","VN",1
"res_district_598","Huyện Hàm Thuận Nam","VN-60-598","Huyện Hàm Thuận Nam, Tỉnh Bình Thuận","base.state_vn_VN-40","VN",1
"res_district_599","Huyện Tánh Linh","VN-60-599","Huyện Tánh Linh, Tỉnh Bình Thuận","base.state_vn_VN-40","VN",1
"res_district_600","Huyện Đức Linh","VN-60-600","Huyện Đức Linh, Tỉnh Bình Thuận","base.state_vn_VN-40","VN",1
"res_district_601","Huyện Hàm Tân","VN-60-601","Huyện Hàm Tân, Tỉnh Bình Thuận","base.state_vn_VN-40","VN",1
"res_district_602","Huyện Phú Quí","VN-60-602","Huyện Phú Quí, Tỉnh Bình Thuận","base.state_vn_VN-40","VN",1
"res_district_608","Thành phố Kon Tum","VN-62-608","Thành phố Kon Tum, Tỉnh Kon Tum","base.state_vn_VN-28","VN",3
"res_district_610","Huyện Đắk Glei","VN-62-610","Huyện Đắk Glei, Tỉnh Kon Tum","base.state_vn_VN-28","VN",1
"res_district_611","Huyện Ngọc Hồi","VN-62-611","Huyện Ngọc Hồi, Tỉnh Kon Tum","base.state_vn_VN-28","VN",1
"res_district_612","Huyện Đắk Tô","VN-62-612","Huyện Đắk Tô, Tỉnh Kon Tum","base.state_vn_VN-28","VN",1
"res_district_613","Huyện Kon Plông","VN-62-613","Huyện Kon Plông, Tỉnh Kon Tum","base.state_vn_VN-28","VN",1
"res_district_614","Huyện Kon Rẫy","VN-62-614","Huyện Kon Rẫy, Tỉnh Kon Tum","base.state_vn_VN-28","VN",1
"res_district_615","Huyện Đắk Hà","VN-62-615","Huyện Đắk Hà, Tỉnh Kon Tum","base.state_vn_VN-28","VN",1
"res_district_616","Huyện Sa Thầy","VN-62-616","Huyện Sa Thầy, Tỉnh Kon Tum","base.state_vn_VN-28","VN",1
"res_district_617","Huyện Tu Mơ Rông","VN-62-617","Huyện Tu Mơ Rông, Tỉnh Kon Tum","base.state_vn_VN-28","VN",1
"res_district_618","Huyện Ia H' Drai","VN-62-618","Huyện Ia H' Drai, Tỉnh Kon Tum","base.state_vn_VN-28","VN",1
"res_district_622","Thành phố Pleiku","VN-64-622","Thành phố Pleiku, Tỉnh Gia Lai","base.state_vn_VN-30","VN",3
"res_district_623","Thị xã An Khê","VN-64-623","Thị xã An Khê, Tỉnh Gia Lai","base.state_vn_VN-30","VN",2
"res_district_624","Thị xã Ayun Pa","VN-64-624","Thị xã Ayun Pa, Tỉnh Gia Lai","base.state_vn_VN-30","VN",2
"res_district_625","Huyện KBang","VN-64-625","Huyện KBang, Tỉnh Gia Lai","base.state_vn_VN-30","VN",1
"res_district_626","Huyện Đăk Đoa","VN-64-626","Huyện Đăk Đoa, Tỉnh Gia Lai","base.state_vn_VN-30","VN",1
"res_district_627","Huyện Chư Păh","VN-64-627","Huyện Chư Păh, Tỉnh Gia Lai","base.state_vn_VN-30","VN",1
"res_district_628","Huyện Ia Grai","VN-64-628","Huyện Ia Grai, Tỉnh Gia Lai","base.state_vn_VN-30","VN",1
"res_district_629","Huyện Mang Yang","VN-64-629","Huyện Mang Yang, Tỉnh Gia Lai","base.state_vn_VN-30","VN",1
"res_district_630","Huyện Kông Chro","VN-64-630","Huyện Kông Chro, Tỉnh Gia Lai","base.state_vn_VN-30","VN",1
"res_district_631","Huyện Đức Cơ","VN-64-631","Huyện Đức Cơ, Tỉnh Gia Lai","base.state_vn_VN-30","VN",1
"res_district_632","Huyện Chư Prông","VN-64-632","Huyện Chư Prông, Tỉnh Gia Lai","base.state_vn_VN-30","VN",1
"res_district_633","Huyện Chư Sê","VN-64-633","Huyện Chư Sê, Tỉnh Gia Lai","base.state_vn_VN-30","VN",1
"res_district_634","Huyện Đăk Pơ","VN-64-634","Huyện Đăk Pơ, Tỉnh Gia Lai","base.state_vn_VN-30","VN",1
"res_district_635","Huyện Ia Pa","VN-64-635","Huyện Ia Pa, Tỉnh Gia Lai","base.state_vn_VN-30","VN",1
"res_district_637","Huyện Krông Pa","VN-64-637","Huyện Krông Pa, Tỉnh Gia Lai","base.state_vn_VN-30","VN",1
"res_district_638","Huyện Phú Thiện","VN-64-638","Huyện Phú Thiện, Tỉnh Gia Lai","base.state_vn_VN-30","VN",1
"res_district_639","Huyện Chư Pưh","VN-64-639","Huyện Chư Pưh, Tỉnh Gia Lai","base.state_vn_VN-30","VN",1
"res_district_643","Thành phố Buôn Ma Thuột","VN-66-643","Thành phố Buôn Ma Thuột, Tỉnh Đắk Lắk","base.state_vn_VN-33","VN",3
"res_district_644","Thị Xã Buôn Hồ","VN-66-644","Thị Xã Buôn Hồ, Tỉnh Đắk Lắk","base.state_vn_VN-33","VN",2
"res_district_645","Huyện Ea H'leo","VN-66-645","Huyện Ea H'leo, Tỉnh Đắk Lắk","base.state_vn_VN-33","VN",1
"res_district_646","Huyện Ea Súp","VN-66-646","Huyện Ea Súp, Tỉnh Đắk Lắk","base.state_vn_VN-33","VN",1
"res_district_647","Huyện Buôn Đôn","VN-66-647","Huyện Buôn Đôn, Tỉnh Đắk Lắk","base.state_vn_VN-33","VN",1
"res_district_648","Huyện Cư M'gar","VN-66-648","Huyện Cư M'gar, Tỉnh Đắk Lắk","base.state_vn_VN-33","VN",1
"res_district_649","Huyện Krông Búk","VN-66-649","Huyện Krông Búk, Tỉnh Đắk Lắk","base.state_vn_VN-33","VN",1
"res_district_650","Huyện Krông Năng","VN-66-650","Huyện Krông Năng, Tỉnh Đắk Lắk","base.state_vn_VN-33","VN",1
"res_district_651","Huyện Ea Kar","VN-66-651","Huyện Ea Kar, Tỉnh Đắk Lắk","base.state_vn_VN-33","VN",1
"res_district_652","Huyện M'Đrắk","VN-66-652","Huyện M'Đrắk, Tỉnh Đắk Lắk","base.state_vn_VN-33","VN",1
"res_district_653","Huyện Krông Bông","VN-66-653","Huyện Krông Bông, Tỉnh Đắk Lắk","base.state_vn_VN-33","VN",1
"res_district_654","Huyện Krông Pắc","VN-66-654","Huyện Krông Pắc, Tỉnh Đắk Lắk","base.state_vn_VN-33","VN",1
"res_district_655","Huyện Krông A Na","VN-66-655","Huyện Krông A Na, Tỉnh Đắk Lắk","base.state_vn_VN-33","VN",1
"res_district_656","Huyện Lắk","VN-66-656","Huyện Lắk, Tỉnh Đắk Lắk","base.state_vn_VN-33","VN",1
"res_district_657","Huyện Cư Kuin","VN-66-657","Huyện Cư Kuin, Tỉnh Đắk Lắk","base.state_vn_VN-33","VN",1
"res_district_660","Thành phố Gia Nghĩa","VN-67-660","Thành phố Gia Nghĩa, Tỉnh Đắk Nông","base.state_vn_VN-72","VN",3
"res_district_661","Huyện Đăk Glong","VN-67-661","Huyện Đăk Glong, Tỉnh Đắk Nông","base.state_vn_VN-72","VN",1
"res_district_662","Huyện Cư Jút","VN-67-662","Huyện Cư Jút, Tỉnh Đắk Nông","base.state_vn_VN-72","VN",1
"res_district_663","Huyện Đắk Mil","VN-67-663","Huyện Đắk Mil, Tỉnh Đắk Nông","base.state_vn_VN-72","VN",1
"res_district_664","Huyện Krông Nô","VN-67-664","Huyện Krông Nô, Tỉnh Đắk Nông","base.state_vn_VN-72","VN",1
"res_district_665","Huyện Đắk Song","VN-67-665","Huyện Đắk Song, Tỉnh Đắk Nông","base.state_vn_VN-72","VN",1
"res_district_666","Huyện Đắk R'Lấp","VN-67-666","Huyện Đắk R'Lấp, Tỉnh Đắk Nông","base.state_vn_VN-72","VN",1
"res_district_667","Huyện Tuy Đức","VN-67-667","Huyện Tuy Đức, Tỉnh Đắk Nông","base.state_vn_VN-72","VN",1
"res_district_672","Thành phố Đà Lạt","VN-68-672","Thành phố Đà Lạt, Tỉnh Lâm Đồng","base.state_vn_VN-35","VN",3
"res_district_673","Thành phố Bảo Lộc","VN-68-673","Thành phố Bảo Lộc, Tỉnh Lâm Đồng","base.state_vn_VN-35","VN",3
"res_district_674","Huyện Đam Rông","VN-68-674","Huyện Đam Rông, Tỉnh Lâm Đồng","base.state_vn_VN-35","VN",1
"res_district_675","Huyện Lạc Dương","VN-68-675","Huyện Lạc Dương, Tỉnh Lâm Đồng","base.state_vn_VN-35","VN",1
"res_district_676","Huyện Lâm Hà","VN-68-676","Huyện Lâm Hà, Tỉnh Lâm Đồng","base.state_vn_VN-35","VN",1
"res_district_677","Huyện Đơn Dương","VN-68-677","Huyện Đơn Dương, Tỉnh Lâm Đồng","base.state_vn_VN-35","VN",1
"res_district_678","Huyện Đức Trọng","VN-68-678","Huyện Đức Trọng, Tỉnh Lâm Đồng","base.state_vn_VN-35","VN",1
"res_district_679","Huyện Di Linh","VN-68-679","Huyện Di Linh, Tỉnh Lâm Đồng","base.state_vn_VN-35","VN",1
"res_district_680","Huyện Bảo Lâm","VN-68-680","Huyện Bảo Lâm, Tỉnh Lâm Đồng","base.state_vn_VN-35","VN",1
"res_district_681","Huyện Đạ Huoai","VN-68-681","Huyện Đạ Huoai, Tỉnh Lâm Đồng","base.state_vn_VN-35","VN",1
"res_district_682","Huyện Đạ Tẻh","VN-68-682","Huyện Đạ Tẻh, Tỉnh Lâm Đồng","base.state_vn_VN-35","VN",1
"res_district_683","Huyện Cát Tiên","VN-68-683","Huyện Cát Tiên, Tỉnh Lâm Đồng","base.state_vn_VN-35","VN",1
"res_district_688","Thị xã Phước Long","VN-70-688","Thị xã Phước Long, Tỉnh Bình Phước","base.state_vn_VN-58","VN",2
"res_district_689","Thành phố Đồng Xoài","VN-70-689","Thành phố Đồng Xoài, Tỉnh Bình Phước","base.state_vn_VN-58","VN",3
"res_district_690","Thị xã Bình Long","VN-70-690","Thị xã Bình Long, Tỉnh Bình Phước","base.state_vn_VN-58","VN",2
"res_district_691","Huyện Bù Gia Mập","VN-70-691","Huyện Bù Gia Mập, Tỉnh Bình Phước","base.state_vn_VN-58","VN",1
"res_district_692","Huyện Lộc Ninh","VN-70-692","Huyện Lộc Ninh, Tỉnh Bình Phước","base.state_vn_VN-58","VN",1
"res_district_693","Huyện Bù Đốp","VN-70-693","Huyện Bù Đốp, Tỉnh Bình Phước","base.state_vn_VN-58","VN",1
"res_district_694","Huyện Hớn Quản","VN-70-694","Huyện Hớn Quản, Tỉnh Bình Phước","base.state_vn_VN-58","VN",1
"res_district_695","Huyện Đồng Phú","VN-70-695","Huyện Đồng Phú, Tỉnh Bình Phước","base.state_vn_VN-58","VN",1
"res_district_696","Huyện Bù Đăng","VN-70-696","Huyện Bù Đăng, Tỉnh Bình Phước","base.state_vn_VN-58","VN",1
"res_district_697","Thị xã Chơn Thành","VN-70-697","Thị xã Chơn Thành, Tỉnh Bình Phước","base.state_vn_VN-58","VN",2
"res_district_698","Huyện Phú Riềng","VN-70-698","Huyện Phú Riềng, Tỉnh Bình Phước","base.state_vn_VN-58","VN",1
"res_district_703","Thành phố Tây Ninh","VN-72-703","Thành phố Tây Ninh, Tỉnh Tây Ninh","base.state_vn_VN-37","VN",3
"res_district_705","Huyện Tân Biên","VN-72-705","Huyện Tân Biên, Tỉnh Tây Ninh","base.state_vn_VN-37","VN",1
"res_district_706","Huyện Tân Châu","VN-72-706","Huyện Tân Châu, Tỉnh Tây Ninh","base.state_vn_VN-37","VN",1
"res_district_707","Huyện Dương Minh Châu","VN-72-707","Huyện Dương Minh Châu, Tỉnh Tây Ninh","base.state_vn_VN-37","VN",1
"res_district_708","Huyện Châu Thành","VN-72-708","Huyện Châu Thành, Tỉnh Tây Ninh","base.state_vn_VN-37","VN",1
"res_district_709","Thị xã Hòa Thành","VN-72-709","Thị xã Hòa Thành, Tỉnh Tây Ninh","base.state_vn_VN-37","VN",2
"res_district_710","Huyện Gò Dầu","VN-72-710","Huyện Gò Dầu, Tỉnh Tây Ninh","base.state_vn_VN-37","VN",1
"res_district_711","Huyện Bến Cầu","VN-72-711","Huyện Bến Cầu, Tỉnh Tây Ninh","base.state_vn_VN-37","VN",1
"res_district_712","Thị xã Trảng Bàng","VN-72-712","Thị xã Trảng Bàng, Tỉnh Tây Ninh","base.state_vn_VN-37","VN",2
"res_district_718","Thành phố Thủ Dầu Một","VN-74-718","Thành phố Thủ Dầu Một, Tỉnh Bình Dương","base.state_vn_VN-57","VN",3
"res_district_719","Huyện Bàu Bàng","VN-74-719","Huyện Bàu Bàng, Tỉnh Bình Dương","base.state_vn_VN-57","VN",1
"res_district_720","Huyện Dầu Tiếng","VN-74-720","Huyện Dầu Tiếng, Tỉnh Bình Dương","base.state_vn_VN-57","VN",1
"res_district_721","Thị xã Bến Cát","VN-74-721","Thị xã Bến Cát, Tỉnh Bình Dương","base.state_vn_VN-57","VN",2
"res_district_722","Huyện Phú Giáo","VN-74-722","Huyện Phú Giáo, Tỉnh Bình Dương","base.state_vn_VN-57","VN",1
"res_district_723","Thành phố Tân Uyên","VN-74-723","Thành phố Tân Uyên, Tỉnh Bình Dương","base.state_vn_VN-57","VN",3
"res_district_724","Thành phố Dĩ An","VN-74-724","Thành phố Dĩ An, Tỉnh Bình Dương","base.state_vn_VN-57","VN",3
"res_district_725","Thành phố Thuận An","VN-74-725","Thành phố Thuận An, Tỉnh Bình Dương","base.state_vn_VN-57","VN",3
"res_district_726","Huyện Bắc Tân Uyên","VN-74-726","Huyện Bắc Tân Uyên, Tỉnh Bình Dương","base.state_vn_VN-57","VN",1
"res_district_731","Thành phố Biên Hòa","VN-75-731","Thành phố Biên Hòa, Tỉnh Đồng Nai","base.state_vn_VN-39","VN",3
"res_district_732","Thành phố Long Khánh","VN-75-732","Thành phố Long Khánh, Tỉnh Đồng Nai","base.state_vn_VN-39","VN",3
"res_district_734","Huyện Tân Phú","VN-75-734","Huyện Tân Phú, Tỉnh Đồng Nai","base.state_vn_VN-39","VN",1
"res_district_735","Huyện Vĩnh Cửu","VN-75-735","Huyện Vĩnh Cửu, Tỉnh Đồng Nai","base.state_vn_VN-39","VN",1
"res_district_736","Huyện Định Quán","VN-75-736","Huyện Định Quán, Tỉnh Đồng Nai","base.state_vn_VN-39","VN",1
"res_district_737","Huyện Trảng Bom","VN-75-737","Huyện Trảng Bom, Tỉnh Đồng Nai","base.state_vn_VN-39","VN",1
"res_district_738","Huyện Thống Nhất","VN-75-738","Huyện Thống Nhất, Tỉnh Đồng Nai","base.state_vn_VN-39","VN",1
"res_district_739","Huyện Cẩm Mỹ","VN-75-739","Huyện Cẩm Mỹ, Tỉnh Đồng Nai","base.state_vn_VN-39","VN",1
"res_district_740","Huyện Long Thành","VN-75-740","Huyện Long Thành, Tỉnh Đồng Nai","base.state_vn_VN-39","VN",1
"res_district_741","Huyện Xuân Lộc","VN-75-741","Huyện Xuân Lộc, Tỉnh Đồng Nai","base.state_vn_VN-39","VN",1
"res_district_742","Huyện Nhơn Trạch","VN-75-742","Huyện Nhơn Trạch, Tỉnh Đồng Nai","base.state_vn_VN-39","VN",1
"res_district_747","Thành phố Vũng Tàu","VN-77-747","Thành phố Vũng Tàu, Tỉnh Bà Rịa, Vũng Tàu","base.state_vn_VN-43","VN",3
"res_district_748","Thành phố Bà Rịa","VN-77-748","Thành phố Bà Rịa, Tỉnh Bà Rịa, Vũng Tàu","base.state_vn_VN-43","VN",3
"res_district_750","Huyện Châu Đức","VN-77-750","Huyện Châu Đức, Tỉnh Bà Rịa, Vũng Tàu","base.state_vn_VN-43","VN",1
"res_district_751","Huyện Xuyên Mộc","VN-77-751","Huyện Xuyên Mộc, Tỉnh Bà Rịa, Vũng Tàu","base.state_vn_VN-43","VN",1
"res_district_752","Huyện Long Điền","VN-77-752","Huyện Long Điền, Tỉnh Bà Rịa, Vũng Tàu","base.state_vn_VN-43","VN",1
"res_district_753","Huyện Đất Đỏ","VN-77-753","Huyện Đất Đỏ, Tỉnh Bà Rịa, Vũng Tàu","base.state_vn_VN-43","VN",1
"res_district_754","Thị xã Phú Mỹ","VN-77-754","Thị xã Phú Mỹ, Tỉnh Bà Rịa, Vũng Tàu","base.state_vn_VN-43","VN",2
"res_district_755","Huyện Côn Đảo","VN-77-755","Huyện Côn Đảo, Tỉnh Bà Rịa, Vũng Tàu","base.state_vn_VN-43","VN",1
"res_district_760","Quận 1","VN-79-760","Quận 1, Thành phố Hồ Chí Minh","base.state_vn_VN-SG","VN",0
"res_district_761","Quận 12","VN-79-761","Quận 12, Thành phố Hồ Chí Minh","base.state_vn_VN-SG","VN",0
"res_district_764","Quận Gò Vấp","VN-79-764","Quận Gò Vấp, Thành phố Hồ Chí Minh","base.state_vn_VN-SG","VN",0
"res_district_765","Quận Bình Thạnh","VN-79-765","Quận Bình Thạnh, Thành phố Hồ Chí Minh","base.state_vn_VN-SG","VN",0
"res_district_766","Quận Tân Bình","VN-79-766","Quận Tân Bình, Thành phố Hồ Chí Minh","base.state_vn_VN-SG","VN",0
"res_district_767","Quận Tân Phú","VN-79-767","Quận Tân Phú, Thành phố Hồ Chí Minh","base.state_vn_VN-SG","VN",0
"res_district_768","Quận Phú Nhuận","VN-79-768","Quận Phú Nhuận, Thành phố Hồ Chí Minh","base.state_vn_VN-SG","VN",0
"res_district_769","Thành phố Thủ Đức","VN-79-769","Thành phố Thủ Đức, Thành phố Hồ Chí Minh","base.state_vn_VN-SG","VN",3
"res_district_770","Quận 3","VN-79-770","Quận 3, Thành phố Hồ Chí Minh","base.state_vn_VN-SG","VN",0
"res_district_771","Quận 10","VN-79-771","Quận 10, Thành phố Hồ Chí Minh","base.state_vn_VN-SG","VN",0
"res_district_772","Quận 11","VN-79-772","Quận 11, Thành phố Hồ Chí Minh","base.state_vn_VN-SG","VN",0
"res_district_773","Quận 4","VN-79-773","Quận 4, Thành phố Hồ Chí Minh","base.state_vn_VN-SG","VN",0
"res_district_774","Quận 5","VN-79-774","Quận 5, Thành phố Hồ Chí Minh","base.state_vn_VN-SG","VN",0
"res_district_775","Quận 6","VN-79-775","Quận 6, Thành phố Hồ Chí Minh","base.state_vn_VN-SG","VN",0
"res_district_776","Quận 8","VN-79-776","Quận 8, Thành phố Hồ Chí Minh","base.state_vn_VN-SG","VN",0
"res_district_777","Quận Bình Tân","VN-79-777","Quận Bình Tân, Thành phố Hồ Chí Minh","base.state_vn_VN-SG","VN",0
"res_district_778","Quận 7","VN-79-778","Quận 7, Thành phố Hồ Chí Minh","base.state_vn_VN-SG","VN",0
"res_district_783","Huyện Củ Chi","VN-79-783","Huyện Củ Chi, Thành phố Hồ Chí Minh","base.state_vn_VN-SG","VN",1
"res_district_784","Huyện Hóc Môn","VN-79-784","Huyện Hóc Môn, Thành phố Hồ Chí Minh","base.state_vn_VN-SG","VN",1
"res_district_785","Huyện Bình Chánh","VN-79-785","Huyện Bình Chánh, Thành phố Hồ Chí Minh","base.state_vn_VN-SG","VN",1
"res_district_786","Huyện Nhà Bè","VN-79-786","Huyện Nhà Bè, Thành phố Hồ Chí Minh","base.state_vn_VN-SG","VN",1
"res_district_787","Huyện Cần Giờ","VN-79-787","Huyện Cần Giờ, Thành phố Hồ Chí Minh","base.state_vn_VN-SG","VN",1
"res_district_794","Thành phố Tân An","VN-80-794","Thành phố Tân An, Tỉnh Long An","base.state_vn_VN-41","VN",3
"res_district_795","Thị xã Kiến Tường","VN-80-795","Thị xã Kiến Tường, Tỉnh Long An","base.state_vn_VN-41","VN",2
"res_district_796","Huyện Tân Hưng","VN-80-796","Huyện Tân Hưng, Tỉnh Long An","base.state_vn_VN-41","VN",1
"res_district_797","Huyện Vĩnh Hưng","VN-80-797","Huyện Vĩnh Hưng, Tỉnh Long An","base.state_vn_VN-41","VN",1
"res_district_798","Huyện Mộc Hóa","VN-80-798","Huyện Mộc Hóa, Tỉnh Long An","base.state_vn_VN-41","VN",1
"res_district_799","Huyện Tân Thạnh","VN-80-799","Huyện Tân Thạnh, Tỉnh Long An","base.state_vn_VN-41","VN",1
"res_district_800","Huyện Thạnh Hóa","VN-80-800","Huyện Thạnh Hóa, Tỉnh Long An","base.state_vn_VN-41","VN",1
"res_district_801","Huyện Đức Huệ","VN-80-801","Huyện Đức Huệ, Tỉnh Long An","base.state_vn_VN-41","VN",1
"res_district_802","Huyện Đức Hòa","VN-80-802","Huyện Đức Hòa, Tỉnh Long An","base.state_vn_VN-41","VN",1
"res_district_803","Huyện Bến Lức","VN-80-803","Huyện Bến Lức, Tỉnh Long An","base.state_vn_VN-41","VN",1
"res_district_804","Huyện Thủ Thừa","VN-80-804","Huyện Thủ Thừa, Tỉnh Long An","base.state_vn_VN-41","VN",1
"res_district_805","Huyện Tân Trụ","VN-80-805","Huyện Tân Trụ, Tỉnh Long An","base.state_vn_VN-41","VN",1
"res_district_806","Huyện Cần Đước","VN-80-806","Huyện Cần Đước, Tỉnh Long An","base.state_vn_VN-41","VN",1
"res_district_807","Huyện Cần Giuộc","VN-80-807","Huyện Cần Giuộc, Tỉnh Long An","base.state_vn_VN-41","VN",1
"res_district_808","Huyện Châu Thành","VN-80-808","Huyện Châu Thành, Tỉnh Long An","base.state_vn_VN-41","VN",1
"res_district_815","Thành phố Mỹ Tho","VN-82-815","Thành phố Mỹ Tho, Tỉnh Tiền Giang","base.state_vn_VN-46","VN",3
"res_district_816","Thị xã Gò Công","VN-82-816","Thị xã Gò Công, Tỉnh Tiền Giang","base.state_vn_VN-46","VN",2
"res_district_817","Thị xã Cai Lậy","VN-82-817","Thị xã Cai Lậy, Tỉnh Tiền Giang","base.state_vn_VN-46","VN",2
"res_district_818","Huyện Tân Phước","VN-82-818","Huyện Tân Phước, Tỉnh Tiền Giang","base.state_vn_VN-46","VN",1
"res_district_819","Huyện Cái Bè","VN-82-819","Huyện Cái Bè, Tỉnh Tiền Giang","base.state_vn_VN-46","VN",1
"res_district_820","Huyện Cai Lậy","VN-82-820","Huyện Cai Lậy, Tỉnh Tiền Giang","base.state_vn_VN-46","VN",1
"res_district_821","Huyện Châu Thành","VN-82-821","Huyện Châu Thành, Tỉnh Tiền Giang","base.state_vn_VN-46","VN",1
"res_district_822","Huyện Chợ Gạo","VN-82-822","Huyện Chợ Gạo, Tỉnh Tiền Giang","base.state_vn_VN-46","VN",1
"res_district_823","Huyện Gò Công Tây","VN-82-823","Huyện Gò Công Tây, Tỉnh Tiền Giang","base.state_vn_VN-46","VN",1
"res_district_824","Huyện Gò Công Đông","VN-82-824","Huyện Gò Công Đông, Tỉnh Tiền Giang","base.state_vn_VN-46","VN",1
"res_district_825","Huyện Tân Phú Đông","VN-82-825","Huyện Tân Phú Đông, Tỉnh Tiền Giang","base.state_vn_VN-46","VN",1
"res_district_829","Thành phố Bến Tre","VN-83-829","Thành phố Bến Tre, Tỉnh Bến Tre","base.state_vn_VN-50","VN",3
"res_district_831","Huyện Châu Thành","VN-83-831","Huyện Châu Thành, Tỉnh Bến Tre","base.state_vn_VN-50","VN",1
"res_district_832","Huyện Chợ Lách","VN-83-832","Huyện Chợ Lách, Tỉnh Bến Tre","base.state_vn_VN-50","VN",1
"res_district_833","Huyện Mỏ Cày Nam","VN-83-833","Huyện Mỏ Cày Nam, Tỉnh Bến Tre","base.state_vn_VN-50","VN",1
"res_district_834","Huyện Giồng Trôm","VN-83-834","Huyện Giồng Trôm, Tỉnh Bến Tre","base.state_vn_VN-50","VN",1
"res_district_835","Huyện Bình Đại","VN-83-835","Huyện Bình Đại, Tỉnh Bến Tre","base.state_vn_VN-50","VN",1
"res_district_836","Huyện Ba Tri","VN-83-836","Huyện Ba Tri, Tỉnh Bến Tre","base.state_vn_VN-50","VN",1
"res_district_837","Huyện Thạnh Phú","VN-83-837","Huyện Thạnh Phú, Tỉnh Bến Tre","base.state_vn_VN-50","VN",1
"res_district_838","Huyện Mỏ Cày Bắc","VN-83-838","Huyện Mỏ Cày Bắc, Tỉnh Bến Tre","base.state_vn_VN-50","VN",1
"res_district_842","Thành phố Trà Vinh","VN-84-842","Thành phố Trà Vinh, Tỉnh Trà Vinh","base.state_vn_VN-51","VN",3
"res_district_844","Huyện Càng Long","VN-84-844","Huyện Càng Long, Tỉnh Trà Vinh","base.state_vn_VN-51","VN",1
"res_district_845","Huyện Cầu Kè","VN-84-845","Huyện Cầu Kè, Tỉnh Trà Vinh","base.state_vn_VN-51","VN",1
"res_district_846","Huyện Tiểu Cần","VN-84-846","Huyện Tiểu Cần, Tỉnh Trà Vinh","base.state_vn_VN-51","VN",1
"res_district_847","Huyện Châu Thành","VN-84-847","Huyện Châu Thành, Tỉnh Trà Vinh","base.state_vn_VN-51","VN",1
"res_district_848","Huyện Cầu Ngang","VN-84-848","Huyện Cầu Ngang, Tỉnh Trà Vinh","base.state_vn_VN-51","VN",1
"res_district_849","Huyện Trà Cú","VN-84-849","Huyện Trà Cú, Tỉnh Trà Vinh","base.state_vn_VN-51","VN",1
"res_district_850","Huyện Duyên Hải","VN-84-850","Huyện Duyên Hải, Tỉnh Trà Vinh","base.state_vn_VN-51","VN",1
"res_district_851","Thị xã Duyên Hải","VN-84-851","Thị xã Duyên Hải, Tỉnh Trà Vinh","base.state_vn_VN-51","VN",2
"res_district_855","Thành phố Vĩnh Long","VN-86-855","Thành phố Vĩnh Long, Tỉnh Vĩnh Long","base.state_vn_VN-49","VN",3
"res_district_857","Huyện Long Hồ","VN-86-857","Huyện Long Hồ, Tỉnh Vĩnh Long","base.state_vn_VN-49","VN",1
"res_district_858","Huyện Mang Thít","VN-86-858","Huyện Mang Thít, Tỉnh Vĩnh Long","base.state_vn_VN-49","VN",1
"res_district_859","Huyện  Vũng Liêm","VN-86-859","Huyện  Vũng Liêm, Tỉnh Vĩnh Long","base.state_vn_VN-49","VN",1
"res_district_860","Huyện Tam Bình","VN-86-860","Huyện Tam Bình, Tỉnh Vĩnh Long","base.state_vn_VN-49","VN",1
"res_district_861","Thị xã Bình Minh","VN-86-861","Thị xã Bình Minh, Tỉnh Vĩnh Long","base.state_vn_VN-49","VN",2
"res_district_862","Huyện Trà Ôn","VN-86-862","Huyện Trà Ôn, Tỉnh Vĩnh Long","base.state_vn_VN-49","VN",1
"res_district_863","Huyện Bình Tân","VN-86-863","Huyện Bình Tân, Tỉnh Vĩnh Long","base.state_vn_VN-49","VN",1
