"id","name","code","slug","state_id:id","country_id","type"
"res_district_866","Thành phố Cao Lãnh","VN-87-866","Thành phố Cao Lãnh, Tỉnh Đồng Tháp","base.state_vn_VN-45","VN",3
"res_district_867","Thành phố Sa Đéc","VN-87-867","Thành phố Sa Đéc, Tỉnh Đồng Tháp","base.state_vn_VN-45","VN",3
"res_district_868","Thành phố Hồng Ngự","VN-87-868","Thành phố Hồng Ngự, Tỉnh Đồng Tháp","base.state_vn_VN-45","VN",3
"res_district_869","Huyện Tân Hồng","VN-87-869","Huyện Tân Hồng, Tỉnh Đồng Tháp","base.state_vn_VN-45","VN",1
"res_district_870","Huyện Hồng Ngự","VN-87-870","Huyện Hồng Ngự, Tỉnh Đồng Tháp","base.state_vn_VN-45","VN",1
"res_district_871","Huyện Tam Nông","VN-87-871","Huyện Tam Nông, Tỉnh Đồng Tháp","base.state_vn_VN-45","VN",1
"res_district_872","Huyện Tháp Mười","VN-87-872","Huyện Tháp Mười, Tỉnh Đồng Tháp","base.state_vn_VN-45","VN",1
"res_district_873","Huyện Cao Lãnh","VN-87-873","Huyện Cao Lãnh, Tỉnh Đồng Tháp","base.state_vn_VN-45","VN",1
"res_district_874","Huyện Thanh Bình","VN-87-874","Huyện Thanh Bình, Tỉnh Đồng Tháp","base.state_vn_VN-45","VN",1
"res_district_875","Huyện Lấp Vò","VN-87-875","Huyện Lấp Vò, Tỉnh Đồng Tháp","base.state_vn_VN-45","VN",1
"res_district_876","Huyện Lai Vung","VN-87-876","Huyện Lai Vung, Tỉnh Đồng Tháp","base.state_vn_VN-45","VN",1
"res_district_877","Huyện Châu Thành","VN-87-877","Huyện Châu Thành, Tỉnh Đồng Tháp","base.state_vn_VN-45","VN",1
"res_district_883","Thành phố Long Xuyên","VN-89-883","Thành phố Long Xuyên, Tỉnh An Giang","base.state_vn_VN-44","VN",3
"res_district_884","Thành phố Châu Đốc","VN-89-884","Thành phố Châu Đốc, Tỉnh An Giang","base.state_vn_VN-44","VN",3
"res_district_886","Huyện An Phú","VN-89-886","Huyện An Phú, Tỉnh An Giang","base.state_vn_VN-44","VN",1
"res_district_887","Thị xã Tân Châu","VN-89-887","Thị xã Tân Châu, Tỉnh An Giang","base.state_vn_VN-44","VN",2
"res_district_888","Huyện Phú Tân","VN-89-888","Huyện Phú Tân, Tỉnh An Giang","base.state_vn_VN-44","VN",1
"res_district_889","Huyện Châu Phú","VN-89-889","Huyện Châu Phú, Tỉnh An Giang","base.state_vn_VN-44","VN",1
"res_district_890","Thị xã Tịnh Biên","VN-89-890","Thị xã Tịnh Biên, Tỉnh An Giang","base.state_vn_VN-44","VN",2
"res_district_891","Huyện Tri Tôn","VN-89-891","Huyện Tri Tôn, Tỉnh An Giang","base.state_vn_VN-44","VN",1
"res_district_892","Huyện Châu Thành","VN-89-892","Huyện Châu Thành, Tỉnh An Giang","base.state_vn_VN-44","VN",1
"res_district_893","Huyện Chợ Mới","VN-89-893","Huyện Chợ Mới, Tỉnh An Giang","base.state_vn_VN-44","VN",1
"res_district_894","Huyện Thoại Sơn","VN-89-894","Huyện Thoại Sơn, Tỉnh An Giang","base.state_vn_VN-44","VN",1
"res_district_899","Thành phố Rạch Giá","VN-91-899","Thành phố Rạch Giá, Tỉnh Kiên Giang","base.state_vn_VN-47","VN",3
"res_district_900","Thành phố Hà Tiên","VN-91-900","Thành phố Hà Tiên, Tỉnh Kiên Giang","base.state_vn_VN-47","VN",3
"res_district_902","Huyện Kiên Lương","VN-91-902","Huyện Kiên Lương, Tỉnh Kiên Giang","base.state_vn_VN-47","VN",1
"res_district_903","Huyện Hòn Đất","VN-91-903","Huyện Hòn Đất, Tỉnh Kiên Giang","base.state_vn_VN-47","VN",1
"res_district_904","Huyện Tân Hiệp","VN-91-904","Huyện Tân Hiệp, Tỉnh Kiên Giang","base.state_vn_VN-47","VN",1
"res_district_905","Huyện Châu Thành","VN-91-905","Huyện Châu Thành, Tỉnh Kiên Giang","base.state_vn_VN-47","VN",1
"res_district_906","Huyện Giồng Riềng","VN-91-906","Huyện Giồng Riềng, Tỉnh Kiên Giang","base.state_vn_VN-47","VN",1
"res_district_907","Huyện Gò Quao","VN-91-907","Huyện Gò Quao, Tỉnh Kiên Giang","base.state_vn_VN-47","VN",1
"res_district_908","Huyện An Biên","VN-91-908","Huyện An Biên, Tỉnh Kiên Giang","base.state_vn_VN-47","VN",1
"res_district_909","Huyện An Minh","VN-91-909","Huyện An Minh, Tỉnh Kiên Giang","base.state_vn_VN-47","VN",1
"res_district_910","Huyện Vĩnh Thuận","VN-91-910","Huyện Vĩnh Thuận, Tỉnh Kiên Giang","base.state_vn_VN-47","VN",1
"res_district_911","Thành phố Phú Quốc","VN-91-911","Thành phố Phú Quốc, Tỉnh Kiên Giang","base.state_vn_VN-47","VN",3
"res_district_912","Huyện Kiên Hải","VN-91-912","Huyện Kiên Hải, Tỉnh Kiên Giang","base.state_vn_VN-47","VN",1
"res_district_913","Huyện U Minh Thượng","VN-91-913","Huyện U Minh Thượng, Tỉnh Kiên Giang","base.state_vn_VN-47","VN",1
"res_district_914","Huyện Giang Thành","VN-91-914","Huyện Giang Thành, Tỉnh Kiên Giang","base.state_vn_VN-47","VN",1
"res_district_916","Quận Ninh Kiều","VN-92-916","Quận Ninh Kiều, Thành phố Cần Thơ","base.state_vn_VN-CT","VN",0
"res_district_917","Quận Ô Môn","VN-92-917","Quận Ô Môn, Thành phố Cần Thơ","base.state_vn_VN-CT","VN",0
"res_district_918","Quận Bình Thuỷ","VN-92-918","Quận Bình Thuỷ, Thành phố Cần Thơ","base.state_vn_VN-CT","VN",0
"res_district_919","Quận Cái Răng","VN-92-919","Quận Cái Răng, Thành phố Cần Thơ","base.state_vn_VN-CT","VN",0
"res_district_923","Quận Thốt Nốt","VN-92-923","Quận Thốt Nốt, Thành phố Cần Thơ","base.state_vn_VN-CT","VN",0
"res_district_924","Huyện Vĩnh Thạnh","VN-92-924","Huyện Vĩnh Thạnh, Thành phố Cần Thơ","base.state_vn_VN-CT","VN",1
"res_district_925","Huyện Cờ Đỏ","VN-92-925","Huyện Cờ Đỏ, Thành phố Cần Thơ","base.state_vn_VN-CT","VN",1
"res_district_926","Huyện Phong Điền","VN-92-926","Huyện Phong Điền, Thành phố Cần Thơ","base.state_vn_VN-CT","VN",1
"res_district_927","Huyện Thới Lai","VN-92-927","Huyện Thới Lai, Thành phố Cần Thơ","base.state_vn_VN-CT","VN",1
"res_district_930","Thành phố Vị Thanh","VN-93-930","Thành phố Vị Thanh, Tỉnh Hậu Giang","base.state_vn_VN-73","VN",3
"res_district_931","Thành phố Ngã Bảy","VN-93-931","Thành phố Ngã Bảy, Tỉnh Hậu Giang","base.state_vn_VN-73","VN",3
"res_district_932","Huyện Châu Thành A","VN-93-932","Huyện Châu Thành A, Tỉnh Hậu Giang","base.state_vn_VN-73","VN",1
"res_district_933","Huyện Châu Thành","VN-93-933","Huyện Châu Thành, Tỉnh Hậu Giang","base.state_vn_VN-73","VN",1
"res_district_934","Huyện Phụng Hiệp","VN-93-934","Huyện Phụng Hiệp, Tỉnh Hậu Giang","base.state_vn_VN-73","VN",1
"res_district_935","Huyện Vị Thuỷ","VN-93-935","Huyện Vị Thuỷ, Tỉnh Hậu Giang","base.state_vn_VN-73","VN",1
"res_district_936","Huyện Long Mỹ","VN-93-936","Huyện Long Mỹ, Tỉnh Hậu Giang","base.state_vn_VN-73","VN",1
"res_district_937","Thị xã Long Mỹ","VN-93-937","Thị xã Long Mỹ, Tỉnh Hậu Giang","base.state_vn_VN-73","VN",2
"res_district_941","Thành phố Sóc Trăng","VN-94-941","Thành phố Sóc Trăng, Tỉnh Sóc Trăng","base.state_vn_VN-52","VN",3
"res_district_942","Huyện Châu Thành","VN-94-942","Huyện Châu Thành, Tỉnh Sóc Trăng","base.state_vn_VN-52","VN",1
"res_district_943","Huyện Kế Sách","VN-94-943","Huyện Kế Sách, Tỉnh Sóc Trăng","base.state_vn_VN-52","VN",1
"res_district_944","Huyện Mỹ Tú","VN-94-944","Huyện Mỹ Tú, Tỉnh Sóc Trăng","base.state_vn_VN-52","VN",1
"res_district_945","Huyện Cù Lao Dung","VN-94-945","Huyện Cù Lao Dung, Tỉnh Sóc Trăng","base.state_vn_VN-52","VN",1
"res_district_946","Huyện Long Phú","VN-94-946","Huyện Long Phú, Tỉnh Sóc Trăng","base.state_vn_VN-52","VN",1
"res_district_947","Huyện Mỹ Xuyên","VN-94-947","Huyện Mỹ Xuyên, Tỉnh Sóc Trăng","base.state_vn_VN-52","VN",1
"res_district_948","Thị xã Ngã Năm","VN-94-948","Thị xã Ngã Năm, Tỉnh Sóc Trăng","base.state_vn_VN-52","VN",2
"res_district_949","Huyện Thạnh Trị","VN-94-949","Huyện Thạnh Trị, Tỉnh Sóc Trăng","base.state_vn_VN-52","VN",1
"res_district_950","Thị xã Vĩnh Châu","VN-94-950","Thị xã Vĩnh Châu, Tỉnh Sóc Trăng","base.state_vn_VN-52","VN",2
"res_district_951","Huyện Trần Đề","VN-94-951","Huyện Trần Đề, Tỉnh Sóc Trăng","base.state_vn_VN-52","VN",1
"res_district_954","Thành phố Bạc Liêu","VN-95-954","Thành phố Bạc Liêu, Tỉnh Bạc Liêu","base.state_vn_VN-55","VN",3
"res_district_956","Huyện Hồng Dân","VN-95-956","Huyện Hồng Dân, Tỉnh Bạc Liêu","base.state_vn_VN-55","VN",1
"res_district_957","Huyện Phước Long","VN-95-957","Huyện Phước Long, Tỉnh Bạc Liêu","base.state_vn_VN-55","VN",1
"res_district_958","Huyện Vĩnh Lợi","VN-95-958","Huyện Vĩnh Lợi, Tỉnh Bạc Liêu","base.state_vn_VN-55","VN",1
"res_district_959","Thị xã Giá Rai","VN-95-959","Thị xã Giá Rai, Tỉnh Bạc Liêu","base.state_vn_VN-55","VN",2
"res_district_960","Huyện Đông Hải","VN-95-960","Huyện Đông Hải, Tỉnh Bạc Liêu","base.state_vn_VN-55","VN",1
"res_district_961","Huyện Hoà Bình","VN-95-961","Huyện Hoà Bình, Tỉnh Bạc Liêu","base.state_vn_VN-55","VN",1
"res_district_964","Thành phố Cà Mau","VN-96-964","Thành phố Cà Mau, Tỉnh Cà Mau","base.state_vn_VN-59","VN",3
"res_district_966","Huyện U Minh","VN-96-966","Huyện U Minh, Tỉnh Cà Mau","base.state_vn_VN-59","VN",1
"res_district_967","Huyện Thới Bình","VN-96-967","Huyện Thới Bình, Tỉnh Cà Mau","base.state_vn_VN-59","VN",1
"res_district_968","Huyện Trần Văn Thời","VN-96-968","Huyện Trần Văn Thời, Tỉnh Cà Mau","base.state_vn_VN-59","VN",1
"res_district_969","Huyện Cái Nước","VN-96-969","Huyện Cái Nước, Tỉnh Cà Mau","base.state_vn_VN-59","VN",1
"res_district_970","Huyện Đầm Dơi","VN-96-970","Huyện Đầm Dơi, Tỉnh Cà Mau","base.state_vn_VN-59","VN",1
"res_district_971","Huyện Năm Căn","VN-96-971","Huyện Năm Căn, Tỉnh Cà Mau","base.state_vn_VN-59","VN",1
"res_district_972","Huyện Phú Tân","VN-96-972","Huyện Phú Tân, Tỉnh Cà Mau","base.state_vn_VN-59","VN",1
"res_district_973","Huyện Ngọc Hiển","VN-96-973","Huyện Ngọc Hiển, Tỉnh Cà Mau","base.state_vn_VN-59","VN",1